<?xml version="1.0" encoding="UTF-8"?>
<!--
5.	Crea un XML que permita almacenar información de contactos y el DTD asociado. 
        Para cada contacto queremos guardar la siguiente información

o	Nombre , Primer apellido, Segundo Apellido : (campos obligatorios y únicos)
o	Edat: (campo obligatorio y únicos)
o	Dirección , ha de contener los siguientes elementos:
	Tipo_via, obligatorio, y con el atributo tipo que puede tener los valores:
•	“calle” o “plaza” o “carretera”.
	piso (opcional).
	Puerta (opcional).
	Numero, código postal,  población y país (obligatorios)
o	Puede tener de cero a múltiples elementos teléfono con atributo tipo (posibles valores de tipo: “fijo”, “móvil”, “casa”, “trabajo”,...)
o	Un elemento de nombre “es_familiar” que puede existir de 0 a 1 vez y que ha de estar vacío.

-->

<!--
    TODO define vocabulary identification data
    PUBLIC ID  : -//vendor//vocabulary//EN
    SYSTEM ID  : http://server/path/__NAME__
-->

<!-- TODO define your own vocabulary/syntax. Example follows:  -->
<!ELEMENT contactos (contacto)>
<!ELEMENT contacto (nombre, apellidos, edad, direccion, telefonos, esFamiliar*)>
<!ELEMENT nombre (#PCDATA)>
<!ELEMENT apellidos (apellido+)>
<!ELEMENT apellido (#PCDATA)>
<!ELEMENT edad (#PCDATA)>
<!ELEMENT direccion (tipo_via, piso*, puerta*, numero, cp, poblacion, pais)>
<!ELEMENT tipo_via (#PCDATA)>
<!ATTLIST tipo_via tipo (calle|plaza|carretera) #REQUIRED>
<!ELEMENT piso (#PCDATA)>
<!ELEMENT puerta (#PCDATA)>
<!ELEMENT numero (#PCDATA)>
<!ELEMENT cp (#PCDATA)>
<!ELEMENT poblacion (#PCDATA)>
<!ELEMENT pais (#PCDATA)>
<!ELEMENT telefonos (telefono*)>
<!ELEMENT telefono (#PCDATA)>
<!ATTLIST telefono tipo (fijo|casa|movil|trabajo) #REQUIRED>
<!ELEMENT esFamiliar EMPTY>